{
  "schema": "system_patrol_registry.v1",
  "generated_at": "2026-07-05T13:05:53.894Z",
  "mode": "strict_required_coverage",
  "source_refs": [
    "examples/system-process-tree.json",
    "dialogue-system-patrol/docs/complete-system-patrol-plan.md",
    "dialogue-system-patrol/docs/execution-compass.md",
    "dialogue-system-patrol/docs/module-onboarding-gate.md",
    "dialogue-system-patrol/scripts/run-patrol-maintainer.mjs",
    "dialogue-system-patrol/scripts/publish-patrol-surfaces.mjs",
    "dialogue-system-patrol/scripts/source-hash-lib.mjs",
    "dialogue-system-patrol/scripts/check-source-drift.mjs",
    "dialogue-system-patrol/scripts/scaffold-module-patrol.mjs",
    "dialogue-system-patrol/scripts/install-git-hooks.mjs",
    ".githooks/pre-commit",
    ".github/workflows/system-patrol.yml",
    "dialogue-system-patrol/schemas/module-build-timeline-event.schema.json",
    "dialogue-system-patrol/templates/module-build-timeline-event.template.json",
    "dialogue-system-patrol/scripts/build-timeline-lib.mjs",
    "dialogue-system-patrol/scripts/write-build-timeline-event.mjs"
  ],
  "default_coverage": "required",
  "strict_missing_blocks": true,
  "entries": [
    {
      "module_id": "dialogue_system_patrol",
      "display_name": "Dialogue System Patrol",
      "owner": "process_tree",
      "source": "process_tree",
      "coverage": "required",
      "process_tree_node_id": "dialogue_system_patrol",
      "parent_module_id": null,
      "reason": "Registered in examples/system-process-tree.json after Phase 1 validator, publisher, process-tree and Obsidian proof.",
      "patrol_block_path": "dialogue-system-patrol/blocks/dialogue_system_patrol.patrol.json",
      "status_card_output": "runtime/status-cards/dialogue_system_patrol.json",
      "status_event_output": "runtime/status-events/dialogue_system_patrol.json",
      "gate": "system_patrol_coverage_gate",
      "compass": "system_patrol.dialogue_system_patrol",
      "ttl_ms": 604800000,
      "notes": [
        "Self patrol block remains manually maintained so the patrol core is not overwritten by generic process-tree initialization.",
        "Normal module changes update their module patrol block and regenerated runtime status; patrol-core changes require protocol confirmation.",
        "Re-run npm.cmd run system-patrol:validate and npm.cmd run process-tree:validate after process-tree or Obsidian registration changes.",
        "Strict required coverage is enabled; missing block/card/event or failed validation blocks current-state claims.",
        "Source drift detection is active; source_hash mismatches block current-state claims until reviewed and refreshed.",
        "system-patrol:enforce is the shared CI/pre-commit entry for all-module patrol verification.",
        "system-patrol:scaffold is the preferred entry for adding patrol coverage to new process-tree modules.",
        "Build timeline output is mandatory; construction-time state must be appended before module gate claims current status."
      ],
      "build_timeline_output": "runtime/module-build-timelines/dialogue_system_patrol.jsonl"
    },
    {
      "module_id": "layered_architecture",
      "display_name": "分层架构",
      "owner": "process_tree",
      "source": "process_tree",
      "coverage": "required",
      "process_tree_node_id": "layered_architecture",
      "parent_module_id": null,
      "reason": "Derived from examples/system-process-tree.json and initialized by system-patrol:blocks:init.",
      "patrol_block_path": "dialogue-system-patrol/blocks/layered_architecture.patrol.json",
      "status_card_output": "runtime/status-cards/layered_architecture.json",
      "status_event_output": "runtime/status-events/layered_architecture.json",
      "gate": "system_patrol_coverage_gate",
      "compass": "system_patrol.layered_architecture",
      "ttl_ms": 604800000,
      "notes": [
        "Patrol block initialized from process-tree summary evidence; review before treating as deep module interpretation.",
        "Strict required coverage is enabled; missing block/card/event or failed validation blocks current-state claims.",
        "Build timeline output is mandatory; construction-time state must be appended before module gate claims current status."
      ],
      "build_timeline_output": "runtime/module-build-timelines/layered_architecture.jsonl"
    },
    {
      "module_id": "three_layer_audit",
      "display_name": "三层审计",
      "owner": "process_tree",
      "source": "process_tree",
      "coverage": "required",
      "process_tree_node_id": "three_layer_audit",
      "parent_module_id": null,
      "reason": "Derived from examples/system-process-tree.json and initialized by system-patrol:blocks:init.",
      "patrol_block_path": "dialogue-system-patrol/blocks/three_layer_audit.patrol.json",
      "status_card_output": "runtime/status-cards/three_layer_audit.json",
      "status_event_output": "runtime/status-events/three_layer_audit.json",
      "gate": "system_patrol_coverage_gate",
      "compass": "system_patrol.three_layer_audit",
      "ttl_ms": 604800000,
      "notes": [
        "Patrol block initialized from process-tree summary evidence; review before treating as deep module interpretation.",
        "Strict required coverage is enabled; missing block/card/event or failed validation blocks current-state claims.",
        "Build timeline output is mandatory; construction-time state must be appended before module gate claims current status."
      ],
      "build_timeline_output": "runtime/module-build-timelines/three_layer_audit.jsonl"
    },
    {
      "module_id": "user_goal",
      "display_name": "用户目标",
      "owner": "process_tree",
      "source": "process_tree",
      "coverage": "required",
      "process_tree_node_id": "user_goal",
      "parent_module_id": null,
      "reason": "Derived from examples/system-process-tree.json and initialized by system-patrol:blocks:init.",
      "patrol_block_path": "dialogue-system-patrol/blocks/user_goal.patrol.json",
      "status_card_output": "runtime/status-cards/user_goal.json",
      "status_event_output": "runtime/status-events/user_goal.json",
      "gate": "system_patrol_coverage_gate",
      "compass": "system_patrol.user_goal",
      "ttl_ms": 604800000,
      "notes": [
        "Patrol block initialized from process-tree summary evidence; review before treating as deep module interpretation.",
        "Strict required coverage is enabled; missing block/card/event or failed validation blocks current-state claims.",
        "Build timeline output is mandatory; construction-time state must be appended before module gate claims current status."
      ],
      "build_timeline_output": "runtime/module-build-timelines/user_goal.jsonl"
    },
    {
      "module_id": "relationship_context",
      "display_name": "人物关系",
      "owner": "process_tree",
      "source": "process_tree",
      "coverage": "required",
      "process_tree_node_id": "relationship_context",
      "parent_module_id": null,
      "reason": "Derived from examples/system-process-tree.json and initialized by system-patrol:blocks:init.",
      "patrol_block_path": "dialogue-system-patrol/blocks/relationship_context.patrol.json",
      "status_card_output": "runtime/status-cards/relationship_context.json",
      "status_event_output": "runtime/status-events/relationship_context.json",
      "gate": "system_patrol_coverage_gate",
      "compass": "system_patrol.relationship_context",
      "ttl_ms": 604800000,
      "notes": [
        "Patrol block initialized from process-tree summary evidence; review before treating as deep module interpretation.",
        "Strict required coverage is enabled; missing block/card/event or failed validation blocks current-state claims.",
        "Build timeline output is mandatory; construction-time state must be appended before module gate claims current status."
      ],
      "build_timeline_output": "runtime/module-build-timelines/relationship_context.jsonl"
    },
    {
      "module_id": "identity_resolution",
      "display_name": "Identity Resolution",
      "owner": "process_tree",
      "source": "process_tree",
      "coverage": "required",
      "process_tree_node_id": "identity_resolution",
      "parent_module_id": null,
      "reason": "Derived from examples/system-process-tree.json and initialized by system-patrol:blocks:init.",
      "patrol_block_path": "dialogue-system-patrol/blocks/identity_resolution.patrol.json",
      "status_card_output": "runtime/status-cards/identity_resolution.json",
      "status_event_output": "runtime/status-events/identity_resolution.json",
      "gate": "system_patrol_coverage_gate",
      "compass": "system_patrol.identity_resolution",
      "ttl_ms": 604800000,
      "notes": [
        "Patrol block initialized from process-tree summary evidence; review before treating as deep module interpretation.",
        "Strict required coverage is enabled; missing block/card/event or failed validation blocks current-state claims.",
        "Build timeline output is mandatory; construction-time state must be appended before module gate claims current status."
      ],
      "build_timeline_output": "runtime/module-build-timelines/identity_resolution.jsonl"
    },
    {
      "module_id": "event_recording",
      "display_name": "事件记录",
      "owner": "process_tree",
      "source": "process_tree",
      "coverage": "required",
      "process_tree_node_id": "event_recording",
      "parent_module_id": null,
      "reason": "Derived from examples/system-process-tree.json and initialized by system-patrol:blocks:init.",
      "patrol_block_path": "dialogue-system-patrol/blocks/event_recording.patrol.json",
      "status_card_output": "runtime/status-cards/event_recording.json",
      "status_event_output": "runtime/status-events/event_recording.json",
      "gate": "system_patrol_coverage_gate",
      "compass": "system_patrol.event_recording",